{"apn_rows_sha256":"9e067a329dfa6ef319de1292a7af617a00eb1ead01b991f62aac44ddb360ca28","reads":[
{"base":{"apn_rows_sha256":"a069dc3759372984a8758f60b8dceafc9f456c8bdfed2ac1d25dc5587a795352","commit":"5358c2598be8db1bbd81e4edbb24f8b76a7f34f1","data_digest":"sha256:e803919120235fa378226d469a9a8d6d52c15bfcb6c2655c611cf105f1b37f73"},"builder":"carrier-data-bot: the private publisher (sanitizer and Android generator)","findings":[{"line":"emergency lead gained|208/09 GID 6332|GPRS,EDGE,UMTS,HSPA,LTE,HSPA+,NR,IWLAN|Android default sos IPV4V6/IPV4V6|sos IPV4V6/IPV4V6 [equal]","rule":"android_default","verdict":"proceed","why":"the new lead asks Android's default emergency request (sos, IPV4V6 both ways)"},{"line":"emergency lead gained|208/09 GID 6336|GPRS,EDGE,UMTS,HSPA,LTE,HSPA+,NR,IWLAN|Android default sos IPV4V6/IPV4V6|sos IPV4V6/IPV4V6 [equal]","rule":"android_default","verdict":"proceed","why":"the new lead asks Android's default emergency request (sos, IPV4V6 both ways)"},{"line":"emergency lead gained|208/09 GID 6530|GPRS,EDGE,UMTS,HSPA,LTE,HSPA+,NR,IWLAN|Android default sos IPV4V6/IPV4V6|sos IPV4V6/IPV4V6 [equal]","rule":"android_default","verdict":"proceed","why":"the new lead asks Android's default emergency request (sos, IPV4V6 both ways)"},{"line":"emergency lead gained|208/09 GID 6538|GPRS,EDGE,UMTS,HSPA,LTE,HSPA+,NR,IWLAN|Android default sos IPV4V6/IPV4V6|sos IPV4V6/IPV4V6 [equal]","rule":"android_default","verdict":"proceed","why":"the new lead asks Android's default emergency request (sos, IPV4V6 both ways)"},{"line":"emergency lead gained|208/09 GID 6630|GPRS,EDGE,UMTS,HSPA,LTE,HSPA+,NR,IWLAN|Android default sos IPV4V6/IPV4V6|sos IPV4V6/IPV4V6 [equal]","rule":"android_default","verdict":"proceed","why":"the new lead asks Android's default emergency request (sos, IPV4V6 both ways)"},{"line":"emergency lead gained|208/09 GID 6636|GPRS,EDGE,UMTS,HSPA,LTE,HSPA+,NR,IWLAN|Android default sos IPV4V6/IPV4V6|sos IPV4V6/IPV4V6 [equal]","rule":"android_default","verdict":"proceed","why":"the new lead asks Android's default emergency request (sos, IPV4V6 both ways)"},{"line":"emergency lead gained|208/09 GID 6638|GPRS,EDGE,UMTS,HSPA,LTE,HSPA+,NR,IWLAN|Android default sos IPV4V6/IPV4V6|sos IPV4V6/IPV4V6 [equal]","rule":"android_default","verdict":"proceed","why":"the new lead asks Android's default emergency request (sos, IPV4V6 both ways)"},{"line":"emergency lead gained|208/09 GID 7330|GPRS,EDGE,UMTS,HSPA,LTE,HSPA+,NR,IWLAN|Android default sos IPV4V6/IPV4V6|sos IPV4V6/IPV4V6 [equal]","rule":"android_default","verdict":"proceed","why":"the new lead asks Android's default emergency request (sos, IPV4V6 both ways)"},{"line":"emergency lead gained|208/09 GID 8030|GPRS,EDGE,UMTS,HSPA,LTE,HSPA+,NR,IWLAN|Android default sos IPV4V6/IPV4V6|sos IPV4V6/IPV4V6 [equal]","rule":"android_default","verdict":"proceed","why":"the new lead asks Android's default emergency request (sos, IPV4V6 both ways)"},{"line":"emergency lead gained|208/09 GID 9030|GPRS,EDGE,UMTS,HSPA,LTE,HSPA+,NR,IWLAN|Android default sos IPV4V6/IPV4V6|sos IPV4V6/IPV4V6 [equal]","rule":"android_default","verdict":"proceed","why":"the new lead asks Android's default emergency request (sos, IPV4V6 both ways)"},{"line":"emergency lead gained|302/220 GID 4b|GPRS,EDGE,UMTS,HSPA,LTE,HSPA+,NR,IWLAN|Android default sos IPV4V6/IPV4V6|sos IPV6/IPV4V6 [IPv6 only]","rule":"stated","verdict":"proceed","why":"a current vendor or LineageOS's own list states this row for emergency on this scope"},{"line":"emergency lead gained|302/220 GID 54|GPRS,EDGE,UMTS,HSPA,LTE,HSPA+,NR,IWLAN|Android default sos IPV4V6/IPV4V6|sos IPV6/IPV4V6 [IPv6 only]","rule":"stated","verdict":"proceed","why":"a current vendor or LineageOS's own list states this row for emergency on this scope"},{"line":"emergency lead gained|302/220 GID 6530|GPRS,EDGE,UMTS,HSPA,LTE,HSPA+,NR,IWLAN|Android default sos IPV4V6/IPV4V6|sos IPV4V6/IPV4V6 [equal]","rule":"android_default","verdict":"proceed","why":"the new lead asks Android's default emergency request (sos, IPV4V6 both ways)"},{"line":"emergency lead gained|302/220 GID 6538|GPRS,EDGE,UMTS,HSPA,LTE,HSPA+,NR,IWLAN|Android default sos IPV4V6/IPV4V6|sos IPV4V6/IPV4V6 [equal]","rule":"android_default","verdict":"proceed","why":"the new lead asks Android's default emergency request (sos, IPV4V6 both ways)"},{"line":"emergency lead gained|302/220 GID 6630|GPRS,EDGE,UMTS,HSPA,LTE,HSPA+,NR,IWLAN|Android default sos IPV4V6/IPV4V6|sos IPV4V6/IPV4V6 [equal]","rule":"android_default","verdict":"proceed","why":"the new lead asks Android's default emergency request (sos, IPV4V6 both ways)"},{"line":"emergency lead gained|302/220 GID 6636|GPRS,EDGE,UMTS,HSPA,LTE,HSPA+,NR,IWLAN|Android default sos IPV4V6/IPV4V6|sos IPV4V6/IPV4V6 [equal]","rule":"android_default","verdict":"proceed","why":"the new lead asks Android's default emergency request (sos, IPV4V6 both ways)"},{"line":"emergency lead gained|302/220 GID 6638|GPRS,EDGE,UMTS,HSPA,LTE,HSPA+,NR,IWLAN|Android default sos IPV4V6/IPV4V6|sos IPV4V6/IPV4V6 [equal]","rule":"android_default","verdict":"proceed","why":"the new lead asks Android's default emergency request (sos, IPV4V6 both ways)"},{"line":"emergency lead gained|302/220 GID 7330|GPRS,EDGE,UMTS,HSPA,LTE,HSPA+,NR,IWLAN|Android default sos IPV4V6/IPV4V6|sos IPV4V6/IPV4V6 [equal]","rule":"android_default","verdict":"proceed","why":"the new lead asks Android's default emergency request (sos, IPV4V6 both ways)"},{"line":"emergency lead gained|302/220 GID 8030|GPRS,EDGE,UMTS,HSPA,LTE,HSPA+,NR,IWLAN|Android default sos IPV4V6/IPV4V6|sos IPV4V6/IPV4V6 [equal]","rule":"android_default","verdict":"proceed","why":"the new lead asks Android's default emergency request (sos, IPV4V6 both ways)"},{"line":"emergency lead gained|302/220 GID 9030|GPRS,EDGE,UMTS,HSPA,LTE,HSPA+,NR,IWLAN|Android default sos IPV4V6/IPV4V6|sos IPV4V6/IPV4V6 [equal]","rule":"android_default","verdict":"proceed","why":"the new lead asks Android's default emergency request (sos, IPV4V6 both ways)"},{"line":"emergency lead gained|302/221 GID 4b|GPRS,EDGE,UMTS,HSPA,LTE,HSPA+,NR,IWLAN|Android default sos IPV4V6/IPV4V6|sos IPV6/IPV4V6 [IPv6 only]","rule":"stated","verdict":"proceed","why":"a current vendor or LineageOS's own list states this row for emergency on this scope"},{"line":"emergency lead gained|302/221 GID 54|GPRS,EDGE,UMTS,HSPA,LTE,HSPA+,NR,IWLAN|Android default sos IPV4V6/IPV4V6|sos IPV6/IPV4V6 [IPv6 only]","rule":"stated","verdict":"proceed","why":"a current vendor or LineageOS's own list states this row for emergency on this scope"},{"line":"emergency lead gained|302/222 GID 54|GPRS,EDGE,UMTS,HSPA,LTE,HSPA+,NR,IWLAN|Android default sos IPV4V6/IPV4V6|sos IPV6/IPV4V6 [IPv6 only]","rule":"stated","verdict":"proceed","why":"a current vendor or LineageOS's own list states this row for emergency on this scope"},{"line":"emergency lead gained|313/340 GID 8030|GPRS,EDGE,UMTS,HSPA,LTE,HSPA+,NR,IWLAN|Android default sos IPV4V6/IPV4V6|sos IPV4V6/IPV4V6 [equal]","rule":"android_default","verdict":"proceed","why":"the new lead asks Android's default emergency request (sos, IPV4V6 both ways)"},{"line":"emergency lead gained|313/340 GID 9030|GPRS,EDGE,UMTS,HSPA,LTE,HSPA+,NR,IWLAN|Android default sos IPV4V6/IPV4V6|sos IPV4V6/IPV4V6 [equal]","rule":"android_default","verdict":"proceed","why":"the new lead asks Android's default emergency request (sos, IPV4V6 both ways)"},{"line":"emergency lead gained|313/790|GPRS,EDGE,UMTS,HSPA,LTE,HSPA+,NR,IWLAN|Android default sos IPV4V6/IPV4V6|sos IPV4V6/IP [IPv4 only]","rule":"stated","verdict":"proceed","why":"a current vendor or LineageOS's own list states this row for emergency on this scope"}],"head":{"apn_rows_sha256":"888d99dafec58c1d0ca4cbe0f73d5ec8c75773b7dc4292ee4d04709524bd370f","data_digest":"sha256:43258b37d48cb6a6132a43b9043865e0b0bcd3280d6a8dbfdb1485863b3cbc8a"},"lines":["emergency lead gained|208/09 GID 6332|GPRS,EDGE,UMTS,HSPA,LTE,HSPA+,NR,IWLAN|Android default sos IPV4V6/IPV4V6|sos IPV4V6/IPV4V6 [equal]","emergency lead gained|208/09 GID 6336|GPRS,EDGE,UMTS,HSPA,LTE,HSPA+,NR,IWLAN|Android default sos IPV4V6/IPV4V6|sos IPV4V6/IPV4V6 [equal]","emergency lead gained|208/09 GID 6530|GPRS,EDGE,UMTS,HSPA,LTE,HSPA+,NR,IWLAN|Android default sos IPV4V6/IPV4V6|sos IPV4V6/IPV4V6 [equal]","emergency lead gained|208/09 GID 6538|GPRS,EDGE,UMTS,HSPA,LTE,HSPA+,NR,IWLAN|Android default sos IPV4V6/IPV4V6|sos IPV4V6/IPV4V6 [equal]","emergency lead gained|208/09 GID 6630|GPRS,EDGE,UMTS,HSPA,LTE,HSPA+,NR,IWLAN|Android default sos IPV4V6/IPV4V6|sos IPV4V6/IPV4V6 [equal]","emergency lead gained|208/09 GID 6636|GPRS,EDGE,UMTS,HSPA,LTE,HSPA+,NR,IWLAN|Android default sos IPV4V6/IPV4V6|sos IPV4V6/IPV4V6 [equal]","emergency lead gained|208/09 GID 6638|GPRS,EDGE,UMTS,HSPA,LTE,HSPA+,NR,IWLAN|Android default sos IPV4V6/IPV4V6|sos IPV4V6/IPV4V6 [equal]","emergency lead gained|208/09 GID 7330|GPRS,EDGE,UMTS,HSPA,LTE,HSPA+,NR,IWLAN|Android default sos IPV4V6/IPV4V6|sos IPV4V6/IPV4V6 [equal]","emergency lead gained|208/09 GID 8030|GPRS,EDGE,UMTS,HSPA,LTE,HSPA+,NR,IWLAN|Android default sos IPV4V6/IPV4V6|sos IPV4V6/IPV4V6 [equal]","emergency lead gained|208/09 GID 9030|GPRS,EDGE,UMTS,HSPA,LTE,HSPA+,NR,IWLAN|Android default sos IPV4V6/IPV4V6|sos IPV4V6/IPV4V6 [equal]","emergency lead gained|302/220 GID 4b|GPRS,EDGE,UMTS,HSPA,LTE,HSPA+,NR,IWLAN|Android default sos IPV4V6/IPV4V6|sos IPV6/IPV4V6 [IPv6 only]","emergency lead gained|302/220 GID 54|GPRS,EDGE,UMTS,HSPA,LTE,HSPA+,NR,IWLAN|Android default sos IPV4V6/IPV4V6|sos IPV6/IPV4V6 [IPv6 only]","emergency lead gained|302/220 GID 6530|GPRS,EDGE,UMTS,HSPA,LTE,HSPA+,NR,IWLAN|Android default sos IPV4V6/IPV4V6|sos IPV4V6/IPV4V6 [equal]","emergency lead gained|302/220 GID 6538|GPRS,EDGE,UMTS,HSPA,LTE,HSPA+,NR,IWLAN|Android default sos IPV4V6/IPV4V6|sos IPV4V6/IPV4V6 [equal]","emergency lead gained|302/220 GID 6630|GPRS,EDGE,UMTS,HSPA,LTE,HSPA+,NR,IWLAN|Android default sos IPV4V6/IPV4V6|sos IPV4V6/IPV4V6 [equal]","emergency lead gained|302/220 GID 6636|